title,label
Python vs. JavaScript: Choosing the Right Language for Your Project - Medium,1
Introduction to Machine Learning Algorithms - DataCamp,1
The Future of Mobile App Development - TechCrunch,1
Top 10 Video Games of All Time - IGN,0
Tips for Growing Your Own Organic Vegetable Garden - Better Homes and Gardens,0
How to Plan Your Dream Wedding - The Knot,0
The Principles of Color Theory in Graphic Design - Adobe Creative Cloud,1
10 Must-Have Graphic Design Tools for Professionals - Creative Bloq,1
Typography Tips and Tricks for Graphic Designers - Smashing Magazine,1
10 Artists Who Revolutionized Graphic Design - AIGA,0
The Best Graphic Design Blogs to Follow for Inspiration - Designmodo,0
Mastering Photoshop Effects for Stunning Visuals - Envato Tuts+,1
Introduction to Fluid Mechanics - MIT OpenCourseWare,1
Guide to Finite Element Analysis - Autodesk,1
The Future of Robotics in Manufacturing - Robotics Online,1
Top 10 DIY Woodworking Projects - Popular Mechanics,0
How to Choose the Right Bicycle for Your Commute - Bicycling,0
Mechanical Engineering Jobs and Career Advice - The Engineer,1
Effective Classroom Management Strategies - Edutopia,1
Engaging Lessons Plans for Interactive Learning - Teachers Pay Teachers,1
10 Tips for Effective Parent-Teacher Communication - Scholastic,1
The Best Child-Friendly Vacation Destinations - TravelPulse,0
Quick and Easy Dinner Recipes for Busy Teachers - Food Network,0
The Ultimate Guide to Outdoor Adventure Activities - REI,0
Nursing Interventions for Cardiovascular Diseases - Nurse.org,1
Latest Research on the Efficiency of Antibiotics - ScienceDirect,1
Effective Communication Techniques for Nurses - American Nurse Today,1
5 Must-Visit Beaches in Hawaii - Travel + Leisure,0
10 Healthy Smoothie Recipes for Weight Loss - Healthline,0
DIY Home Decor Ideas for a Cozy Living Space - HGTV,0
The Future of Sustainable Architecture - ArchDaily,1
Mastering Revit: Advanced Techniques for Architects - LinkedIn Learning,1
Exploring Modern Residential Design Trends - Houzz,1
The 10 Best Vacation Spots for Architecture Enthusiasts - Travel + Leisure,0
Home Decor Ideas to Transform Your Space - Elle Decor,0
Architectural Marvels: The World's Most Impressive Buildings - National Geographic,0
Understanding the Importance of Dental X-Rays - American Dental Association,1
The Latest Advances in Pediatric Dentistry - Dentistry Today,1
7 Foods That Promote Healthy Teeth and Gums - Healthline,1
10 Must-Visit Tourist Attractions in Europe - Lonely Planet,0
The Ultimate Guide to Baking Perfect Chocolate Chip Cookies - Food Network,0
5 Tips for Home Gardening Beginners - Better Homes & Gardens,0
Latest Trends in Molecular Gastronomy - Food & Wine,1
Industrial-Grade Kitchen Equipment and Appliances - Restaurant Supply Store,1
Quick and Easy Cooking Tips for Busy Chefs - Epicurious,1
Best Thai Restaurants in Your City - TripAdvisor,0
Creative Cake Decorating Ideas - Martha Stewart,0
Exploring Different Coffee Roasting Techniques - Coffee Geek,0
Electrical Safety Tips for Homeowners - This Old House,1
How to Wire a 3-Way Switch - Family Handyman,1
The Future of Renewable Energy - National Geographic,1
DIY Outdoor Lighting Ideas - HGTV,0
10 Tips for a Well-Lit Home - Better Homes & Gardens,0
The Best Electric Grills for Summer BBQs - Consumer Reports,0
Common Diseases in Dogs - American Veterinary Medical Association,1
Best Practices for Surgical Procedures in Cats - VetStreet,1
How to Choose the Right Pet Insurance - PetMD,1
10 Cutest Cat Videos of 2021 - BuzzFeed,0
Fun Activities to Keep Your Dog Entertained - Rover,0
The Ultimate Guide to Choosing the Perfect Breed of Dog - The Spruce Pets,0
Latest Developments in Drug Formulations - Pharmaceutical Technology,1
How to Prevent Medication Errors in the Pharmacy - Pharmacy Times,1
Pharmacy Technician Certification Exam Study Guide - PTCB,1
10 Natural Remedies for Better Sleep - Healthline,0
The Best Restaurants for Food Lovers in [City Name] - TripAdvisor,0
Trendy Hairstyles for Summer 2022 - Cosmopolitan,0
Genetic Modification and its Applications - National Geographic,1
The Role of Microbes in Ecosystems - Scientific American,1
Biology Teaching Resources and Lesson Plans - Teachers Pay Teachers,1
10 Best Hiking Trails in the World - Lonely Planet,0
Easy Plant-based Recipes for Beginners - Minimalist Baker,0
How to Choose the Right Running Shoes - Runner's World,0
The Economics of Climate Change - Brookings Institution,1
The Impact of Artificial Intelligence on the Labor Market - World Economic Forum,1
The Economics of Healthcare Reform - Harvard Business Review,1
10 Must-Watch Movies for Economic Enthusiasts - IMDb,0
The Best Books for Understanding Economic History - Goodreads,0
Travel Tips for Economists - Lonely Planet,0
The Art of Interviewing: Tips and Techniques - Journalism.com,1
Investigative Reporting: Uncovering the Truth - NewsWeek,1
Journalism Ethics and Responsibility - Columbia Journalism Review,1
7 Must-Try Coffee Shops in Your City - Buzzfeed,0
The Best Books of 2021: A Reading List for Bookworms - Goodreads,0
Breaking News: Latest Celebrity Gossip and Hollywood Updates - TMZ,0
Mastering Portrait Lighting Techniques - CreativeLive,1
The Ultimate Guide to Landscape Photography - Digital Photography School,1
10 Essential Camera Accessories for Every Photographer - B&H Photo,1
5 Tips for Capturing Stunning Wildlife Photos - National Geographic,0
The Best Cameras for Travel Photography - Lonely Planet,0
How to Take Professional-Looking Photos with Your Smartphone - TechRadar,0
Best Flight Schools in the USA - Aviation Schools Online,1
The Top Aircraft Maintenance Tips Every Pilot Should Know - Boldmethod,1
Flying in Challenging Weather Conditions - Flying Magazine,1
The World's Most Beautiful Airports - Conde Nast Traveler,0
10 Must-Visit Destinations for Aviation Enthusiasts - Travel + Leisure,0
The Ultimate Guide to Flight Simulation - PC Gamer,0
10 Tips for Designing a Functional Kitchen - HGTV,1
Choosing the Right Color Palette for Your Living Room - Apartment Therapy,1
The History of Interior Design Styles - Architectural Digest,1
The Most Beautiful Beaches in the World - Travel + Leisure,0
The Ultimate Guide to DIY Home Decor Projects - Country Living,0
How to Create a Relaxing Bedroom Retreat - Better Homes & Gardens,0
Introduction to 3D Character Animation - Animation Mentor,1
Creating Believable Facial Expressions in Animation - Animation World Network,1
The Art of Storyboarding - Pixar,1
The Evolution of Animation Techniques - Artsy,0
Top 10 Animated Movies of All Time - IMDb,0
How to Get Started with Stop Motion Animation - My Modern Met,0
The Psychology of Criminal Behavior - CriminalJusticeDegreeSchools.com,1
Tactical Strategies for Swift Response - PoliceMag.com,1
Protecting Your Home: A Guide to Crime Prevention - SafeWise,1
The 10 Best True Crime Podcasts to Listen to in 2022 - Thrillist,0
Healthy and Quick Dinner Recipes for Busy Officers - Food.com,0
Home Security Tips for a Safer Neighborhood - ADT,0
Firefighter Training and Certification - National Fire Protection Association,1
Latest Advances in Firefighting Equipment - Firehouse,1
Fire Prevention and Safety Tips for Your Home - SafeWise,1
The Best BBQ Recipes for Your Summer Cookout - Food Network,0
Top 10 Vacation Spots for Adventure Seekers - TripAdvisor,0
How to Improve Your Fitness and Stamina for a Half-Marathon - Runner's World,0
Effective Communication Strategies for Social Workers - NASW,1
Coping with Secondary Traumatic Stress - Social Work Today,1
Supporting LGBTQ Youth in Foster Care - Child Welfare Information Gateway,1
10 Self-Care Tips to Prevent Burnout - Psychology Today,0
The Ultimate Guide to Social Work Licensure - SocialWorkLicensure.org,1
Mental Health Resources for Social Workers - National Alliance on Mental Illness,1
Accounting Basics for Beginners - Investopedia,1
10 Essential Excel Functions for Accountants - QuickBooks,1
Tax Deductions Checklist for Accountants - TurboTax,1
10 Tips for Stress-Free Tax Season - HuffPost,0
How to Manage Personal Finances - NerdWallet,0
Best Budgeting Apps for Accountants - The Balance,0
10 Essential Questions to Ask a Potential Divorce Attorney - FindLaw,1
The Future of Artificial Intelligence in the Legal Profession - Harvard Business Review,1
Top 5 Legal Tech Tools to Boost Efficiency in Your Law Practice - Lawyerist,1
10 Books Every Lawyer Should Read - Goodreads,0
The Best Lawyers in Town: A Guide to Local Dining and Entertainment - Yelp,0
10 Tips for Surviving Law School - Cosmopolitan,0
New Approaches in Cancer Treatment - Oncology Times,1
The Latest Advances in Surgical Techniques - NEJM,1
How to Manage Stress and Burnout - Harvard Health Publishing,1
10 Must-Visit Hiking Trails around the World - National Geographic,0
Delicious Summer Recipes for BBQ Parties - Food Network,0
5 Tips for a Great Night's Sleep - WebMD,0
Understanding Cognitive Behavior Therapy for Anxiety - Psychology Today,1
The Psychology of Decision-Making - Harvard Business Review,1
Managing Stress at Work - Mayo Clinic,1
10 Books Every Psychologist Should Read - Goodreads,0
Travel Tips for a Relaxing Vacation - Lonely Planet,0
The Psychology of Music and Emotion - Rolling Stone,0
Effective Project Management Strategies for Civil Engineers - Engineering.com,1
The Importance of Soil Testing in Construction Projects - Civil Engineering Portal,1
The Future of Renewable Energy in Infrastructure - Engineer News-Record,1
Top 10 Skydiving Destinations for Adrenaline Junkies - Skydive Magazine,0
Exploring the World's Most Beautiful Waterfalls - National Geographic,0
Guide to Making Delicious Homemade Pizzas - Food Network,0
Social Media Marketing Strategies for Small Businesses - HubSpot,1
Email Marketing Best Practices for 2022 - Mailchimp,1
Converting Leads into Customers: A Step-by-Step Guide - Salesforce,1
10 Must-Visit Food Festivals Around the World - Lonely Planet,0
How to DIY Your Home Decor on a Budget - Apartment Therapy,0
The Ultimate Guide to Planning Your Dream Vacation - Travel + Leisure,0
Effective Techniques for Employee Performance Evaluation - HR Daily,1
How to Implement a Diversity and Inclusion Program - SHRM,1
7 Tips for Conducting Successful Job Interviews - The Muse,1
Fashion Trends for the Upcoming Season - Vogue,0
The Best Restaurants in Your City - Yelp,0
10 Tips to Improve Your Home Organization - Real Simple,0
Sales Techniques for Building Rapport with Customers - HubSpot,1
Negotiation Strategies for Sales Representatives - Sales Hacker,1
The Psychology of Persuasion in Sales - Psychology Today,1
10 Must-Visit Restaurants in Your City - Eater,0
The Ultimate Guide to Planning a Backpacking Trip - REI,0
Mastering the Art of Home Mixology - Liquor.com,0
Exploring Data Visualization Techniques with Tableau - Analytics Vidhya,1
Introduction to Statistical Analysis for Data Analysts - DataCamp,1
Optimizing Data Processing with Apache Spark - Towards Data Science,1
Top 10 Data Analysis Tools for Personal Finance - Investopedia,0
Data-Driven Insights on the Latest Gadgets - TechCrunch,0
How to Plan a Budget-Friendly Vacation - Travel + Leisure,0
10 Tips for Creating Compelling Visual Designs - Adobe Creative Cloud,1
Artistic Techniques for Unique Photography - National Geographic,1
How to Choose the Right Color Palette for Your Designs - Smashing Magazine,1
The Ultimate Guide to DIY Home Decor - Apartment Therapy,0
Discovering the Hidden Gems of Street Art - StreetArtNews,0
The Top Fashion Trends for the Upcoming Season - Vogue,0
Fashion Trends for Spring 2022 - Vogue,1
Designing Your Own Fashion Line: Tips and Tricks - Fashionista,1
10 Must-Have Accessories for Fall - Harper's Bazaar,1
The Best New Beauty Products to Try - Allure,0
How to Style Trendy Haircuts - Refinery29,0
Travel Guide: Fashion Capitals of the World - Conde Nast Traveler,0
Mastering HTML5 and CSS3 - Udemy,1
Best JavaScript Frameworks for Web Development - Hackernoon,1
How to Improve Website Performance - Smashing Magazine,1
The Ultimate Guide to Backpacking in Southeast Asia - Lonely Planet,0
10 Most Exciting Video Games of 2022 - IGN,0
Easy DIY Home Decorating Ideas - HGTV,0
Understanding Climate Change Impacts on Biodiversity - National Geographic,1
Methods and Techniques for Environmental Sampling - American Environmental Science Association,1
Exploring Nature Conservation Strategies - World Wildlife Fund,1
10 Tips for Eco-Friendly Home Gardening - Better Homes and Gardens,0
The Ultimate Guide to Sustainable Fashion - Vogue,0
Enjoying Nature: The Best Hiking Trails in the World - Lonely Planet,0
Building and Maintaining Relationships with Journalists - PR Daily,1
How to Craft an Effective Press Release - PRWeek,1
The Art of Crisis Communication - Forbes,1
10 Must-Have Apps for Travel Enthusiasts - Travel + Leisure,0
The Ultimate Guide to Baking Cakes - Food52,0
Discovering New Music and Artists - Pitchfork,0
10 Tips for Staging Your Home to Sell - Realtor.com,1
The Ultimate Guide to Real Estate Listings - Zillow,1
How to Negotiate Home Inspection Repairs - HomeLight,1
Top 10 Vacation Homes to Rent in 2021 - Airbnb,0
5 Must-Visit Restaurants in Your City - Yelp,0
The Beginner's Guide to Gardening - Better Homes & Gardens,0
Digital Library Management Systems - American Library Association,1
Cataloging and Classification Standards - Library of Congress,1
Best Fantasy Books of All Time - Goodreads,0
DIY Crafts and Projects for Book Lovers - CraftGossip,0
Library Advocacy and Funding Resources - Urban Libraries Council,1
The Science Behind Reading and Brain Development - National Institute of Child Health and Human Development,1
The Art of Literary Translation - The Paris Review,1
Professional Translation Services - Proz.com,1
Linguistics and Translation Studies Journal - Journal of Translation Studies,1
The Best Books to Translate in 2022 - Goodreads,0
5 Translation Mistakes That Created International Scandals - BBC,0
How to Learn a New Language Quickly - FluentU,0
10 Essential Guitar Techniques Every Musician Should Master - Guitar World,1
A Beginner's Guide to Music Theory - Music Radar,1
The Best Music Production Software for Professional Musicians - Sound on Sound,1
The Top 10 Songs of All Time - Rolling Stone,0
The Ultimate Guide to Music Festival Fashion - Vogue,0
Learn How to Play Your Favorite Songs on Piano - Playground Sessions,1
Mastering Character Analysis Techniques - Acting Studio,1
Tips for Auditioning for a Broadway Musical - Backstage,1
Exploring Method Acting Techniques - Actors Studio,1
The Top 10 Movies of 2022 - IMDB,0
10 Celebrity Red Carpet Fashion Moments - Vogue,0
Beginner's Guide to Improvisation - Drama Notebook,1
Effective Workout Routines for Building Muscle - Bodybuilding.com,1
Nutrition Tips for Fitness Trainers - Fitbit Blog,1
The Benefits of Yoga for Mind and Body - Yoga Journal,1
6 Tips for a Healthy Work-Life Balance - Lifehacker,0
Best Home Workouts for Busy Professionals - Men's Health,0
Healthy Smoothie Recipes for Post-Workout Recovery - EatingWell,0
Guide to Macronutrients and Their Role in a Healthy Diet - Healthline,1
The Science of Digestion: How the Body Processes Food - National Geographic,1
Simple and Delicious Recipes to Boost Your Immune System - Bon Appétit,1
Top 10 Foods for a Good Night's Sleep - Sleep.org,0
The Best Restaurants for Healthy Eating in Your City - OpenTable,0
5 Surprising Facts About Superfoods You Need to Know - HuffPost,0
Emergency Procedures for Flight Attendants - Airline Training Center,1
Tips for Dealing with Difficult Passengers - The Flight Attendant Life,1
Latest Fashion Trends for Flight Attendants - SkyStyle,1
Top Travel Destinations in Europe - Lonely Planet,0
10 Must-Try Local Cuisines Around the World - TripAdvisor,0
How to Stay Fit and Healthy While Traveling - Travel + Leisure,0
Exploring the Origins of the Universe - Astronomy.com,1
Astronomy Basics: A Beginner's Guide - Space.com,1
The Future of Space Travel - NASA,1
10 Must-Visit Stargazing Spots Around the World - Travel + Leisure,0
How to Capture Stunning Astrophotography - National Geographic,1
The Best Telescopes for Amateur Astronomers - Sky & Telescope,1
The Geological History of the Grand Canyon - National Geographic,1
How to Identify Minerals in the Field - Geology.com,1
New Discoveries in Earthquake Research - Science News,1
10 Most Beautiful Waterfalls in the World - Travel+Leisure,0
A Guide to Brewing Your Own Craft Beer - CraftBeer.com,0
Hiking Trails for Nature Lovers - AllTrails,0
The Effects of Climate Change on Coral Reefs - National Geographic,1
Advanced Oceanography Techniques for Research - Springer,1
The Best Scuba Diving Destinations in the World - Dive Magazine,0
An Ocean Lover's Guide to Sustainable Seafood - Seafood Watch,0
Understanding Tsunamis: Causes and Impact - Earth Observatory,1
The Ocean's Hidden Secrets: Unexplored Deep-Sea Creatures - Smithsonian Ocean,1
The Impact of the Industrial Revolution on Society - History.com,1
Historical Methods: Analyzing Primary Sources - JSTOR,1
10 Influential Women in Ancient History - National Geographic,1
The Best Historical Fiction Novels of All Time - Goodreads,0
World Heritage Sites: Exploring the Wonders of the Past - UNESCO,0
Museum Exhibitions: Unveiling Hidden Histories - Smithsonian Magazine,1
Unearthing Ancient Civilizations: A Comprehensive Guide - National Geographic,1
Exploring the Archaeological Wonders of Egypt - Archaeology Magazine,1
Archaeological Excavations in Pompeii: Uncovering the Past - History Channel,1
10 Must-Visit UNESCO World Heritage Sites - Lonely Planet,0
The Art of Baking: From Archaeology to Pastry - Food Network,0
Uncovering the Ultimate Travel Destinations: A Guide for Archaeologists - Travel + Leisure,1
The Role of Lobbying in American Politics,1
The Influence of Interest Groups on Policy Making - Center for Responsive Politics,1
Understanding Political Institutions - Harvard Kennedy School,1
10 Must-Visit Historical Sites in Europe - Lonely Planet,0
The Rise of Sustainable Fashion - Vogue,0
Top 5 Recipes for a Perfect Summer BBQ - Food Network,0
The Effect of Social Media on Mental Health - Psychology Today,1
Analyzing Social Network Data with Python - DataCamp,1
Understanding Income Inequality Trends - Pew Research Center,1
5 Tips for Building Stronger Relationships - Psychology Today,0
Exploring the History of Jazz Music - All About Jazz,0
The Sociology of Popular Culture - BBC Bitesize,1
